{
  "eventId": "evt_enterprisewhitelistchanged_001",
  "eventType": "EnterpriseWhitelistChanged",
  "schemaVersion": 1,
  "occurredAt": "2026-08-10T02:00:00Z",
  "publishedAt": "2026-08-10T02:00:01Z",
  "producer": "SYS-01",
  "environment": "DEV",
  "audience": [
    "SYS-03",
    "SYS-04",
    "SYS-05",
    "SYS-06",
    "SYS-08"
  ],
  "enterpriseId": "ent_contract_001",
  "aggregateType": "EnterpriseWhitelist",
  "aggregateId": "wls_contract_001",
  "aggregateVersion": 1,
  "traceId": "trace_contract_fixture_001",
  "causationId": null,
  "correlationId": "corr_contract_fixture_001",
  "idempotencyKey": "ENTERPRISE_WHITELIST:wls_contract_001:1",
  "payload": {
    "scopeRef": "wls_contract_001",
    "enterpriseId": "ent_contract_001",
    "abilityCode": "DOUYIN_PUBLISH",
    "status": "ACTIVE",
    "version": 1,
    "effectiveAt": "2026-08-10T02:00:00Z",
    "expiresAt": "2026-09-10T02:00:00Z",
    "reasonCode": "PILOT_APPROVED"
  }
}
